{
  "id": "tengra.tr",
  "locale": "tr",
  "displayName": "Türkçe",
  "nativeName": "Türkçe",
  "version": "1.0.0",
  "description": "Tengra için resmi Türkçe dil paketi.",
  "author": "Tengra Studio",
  "baseLocale": "en",
  "rtl": false,
  "coverage": 100,
  "schemaVersion": "1.0.0",
  "translations": {
    "common": {
      "pin": "Sabitle",
      "unknown": "Bilinmiyor",
      "delete": "Sil",
      "edit": "Düzenle",
      "cancelled": "İptal edildi",
      "completed": "Tamamlanmış",
      "processing": "İşleme...",
      "pending": "Beklemede",
      "error": "Hata",
      "snooze": "Ertele",
      "cancel": "İptal et",
      "unpin": "Sabitlemeyi kaldır",
      "markRead": "Okundu olarak işaretle",
      "loading": "Yükleniyor...",
      "close": "Kapat",
      "dismiss": "Kapat",
      "refresh": "Yenile",
      "save": "Kaydet",
      "saving": "Kaydediliyor",
      "retry": "Yeniden dene",
      "locale": "tr-TR",
      "copied": "Kopyalandı",
      "unknownError": "Bilinmeyen bir hata oluştu",
      "reset": "Sıfırla",
      "retrying": "Yeniden deneniyor...",
      "retryingWithAttempt": "Yeniden deneniyor... ({{attempt}}/{{maxAttempts}})",
      "remindInMinutes": "{{minutes}} dakika sonra hatırlat",
      "operationsInProgress": "{{count}} işlem sürüyor",
      "failoverModelUsed": "{{original}} yerine {{fallback}} kullanılıyor.",
      "offlineBanner": "Çevrimdışısınız. Bazı özellikler kullanılamayabilir.",
      "host": "Sunucu",
      "username": "Kullanıcı adı",
      "password": "Şifre",
      "port": "Port",
      "privateKey": "Özel Anahtar",
      "optional": "İsteğe bağlı",
      "confirm": "Onayla",
      "next": "Sonraki",
      "finalizing": "Sonlandırılıyor...",
      "selectEllipsis": "Seç…",
      "hide": "Gizle",
      "clear": "Temizle",
      "show": "Göster",
      "stop": "Durdur",
      "ai": "Yapay zeka",
      "send": "Gönder",
      "zoomIn": "Yakınlaştır",
      "add": "Ekle",
      "activate": "Etkinleştir",
      "commands": "Komutlar",
      "paused": "Duraklatıldı",
      "info": "Bilgi",
      "authType": "Kimlik Doğrulama Türü",
      "loadingContext": "{{context}} yükleniyor...",
      "timeRemaining": "Yaklaşık {{seconds}} sn kaldı",
      "passphrase": "Parola",
      "type": "Tür",
      "update": "Güncelle",
      "active": "Aktif",
      "deleted": "Silindi",
      "remove": "Kaldır",
      "favorites": "Favoriler",
      "selectAll": "Tümünü seç",
      "search": "Ara",
      "resume": "Sürdür",
      "pause": "Duraklat",
      "details": "Detaylar",
      "notAvailable": "Yok",
      "version": "Sürüm",
      "auto": "Otomatik",
      "size": "Boyut",
      "previous": "Önceki",
      "disabled": "Engelli",
      "pageOf": "Sayfa {{current}} / {{total}}",
      "select": "Seç",
      "saved": "Kaydedildi",
      "copy": "Kopyala",
      "installed": "Yüklendi",
      "searching": "Arama...",
      "more": "Daha",
      "manual": "Manuel",
      "invalidInput": "Geçersiz giriş.",
      "done": "Tamamla",
      "deleteFailed": "Silinemedi",
      "unarchive": "Arşivden kaldır",
      "upload": "Yükle",
      "back": "Geri",
      "generate": "Oluştur",
      "generating": "Oluşturuluyor...",
      "rename": "Yeniden adlandır",
      "success": "Başarı",
      "ellipsis": "...",
      "connect": "Bağlan",
      "draft": "Taslak",
      "minutes": "dakika",
      "hour": "saat",
      "minute": "dakika",
      "kb": "KB",
      "hours": "saat",
      "networkError": "Ağ hatası.",
      "operationFailed": "İşlem başarısız oldu.",
      "fit": "Sığdır",
      "permissionDenied": "İzin reddedildi.",
      "remaining": "kalan",
      "queued": "Sıraya alındı",
      "generateLogos": "Logo Oluştur",
      "itemsSelected": "{{count}} öğe seçildi",
      "resetZoom": "Yakınlaştırmayı Sıfırla",
      "fitView": "Görünümü Sığdır",
      "toClose": "kapatmak için",
      "zoomOut": "Uzaklaştır",
      "healthy": "Sağlıklı",
      "continue": "Devam et",
      "layout": "Düzen",
      "degraded": "Bozulmuş",
      "preview": "Önizleme",
      "yes": "Evet",
      "no": "Hayır",
      "escKey": "Esc",
      "components": "Bileşenler",
      "create": "Oluştur",
      "resetting": "Sıfırlanıyor...",
      "disable": "Devre dışı bırakmak"
    },
    "frontend": {
      "about": {
        "checkUpdates": "Güncellemeleri denetle",
        "privacyPolicy": "Gizlilik Politikası",
        "github": "GitHub",
        "factoryReset": "Fabrika ayarlarına sıfırla",
        "description": "Tengra, geliştiriciler için yerel ve bulut yapay zeka modellerini tek bir arayüzde bir araya getiren yeni nesil bir yapay zeka IDE asistanıdır.",
        "locale": "Yerel ayar",
        "forceReload": "Yeniden yüklemeyi zorla",
        "sessionStart": "Oturum Başlangıcı",
        "buildSync": "Derleme senkronu",
        "buildVersion": "Derleme sürümü",
        "notAvailable": "Yok",
        "updateCheckAlert": "Üretim yapılarında güncelleme kontrolleri etkindir.",
        "factoryResetDesc": "Uygulamayı sıfırlamak için tüm ayarları ve verileri silin.",
        "nativeDiagnostics": "Yerel Teşhis",
        "executeWipe": "Silme işlemini başlat",
        "systemTelemetry": "Sistem Telemetrisi"
      },
      "system": {
        "instructions": {
          "reinforcement": "Kullanıcının dilinde yanıt verin. İngilizce kullanıyorlarsa İngilizce kurallarına ve ifadelerine uyun.",
          "rules": "## DİL KURALLARI (İNGİLİZCE)\n- Kullanıcıyla **İngilizce** iletişim kurmaya öncelik verin.\n- Doğru İngilizce dilbilgisi ve noktalama işaretlerini takip edin.\n- Yanıtlarınızda kısa ve net olun.\n- Kullanıcının üslubuna ve formalite düzeyine uyun.\n- Kullanıcı gündelik bir dil veya küfür kullanıyorsa, uygun olması halinde siz de benzer şekilde yanıt verebilirsiniz.",
          "reminder": "DİL: Kullanıcının mevcut dilini eşleştirin (varsayılan: İngilizce)."
        }
      },
      "accounts": {
        "subtitle": "Bağlı hizmetleri ve API hesaplarını yönetin.",
        "title": "Bağlı Hesaplar",
        "management": "Hesapları Yönet",
        "create": "Oluştur",
        "switch": "Geçiş yap",
        "idPrefix": "İD:",
        "loadFailed": "Hesaplar yüklenemedi.",
        "unnamed": "Adsız hesap",
        "refreshAccounts": "Hesapları yenile",
        "addNewAccount": "Hesap ekle",
        "activeAccounts": "Aktif hesaplar",
        "switchSuccess": "\"{{name}}\" olarak değiştirildi",
        "categories": {
          "aiProviders": "Yapay Zeka Sağlayıcıları",
          "developerTools": "Geliştirici Araçları",
          "localModels": "Yerel Modeller",
          "apiKeyProviders": "API Anahtarı Sağlayıcıları"
        },
        "accountNamePlaceholder": "Hesap adı (ör. İş, Kişisel)",
        "switchFailed": "Hesap değiştirilemedi.",
        "createSuccess": "\"{{name}}\" hesabı oluşturuldu",
        "createFailed": "Hesap oluşturulamadı.",
        "addApiKey": "Anahtar Ekle",
        "getApiKey": "API anahtarını al",
        "providers": {
          "github": {
            "name": "GitHub",
            "description": "Kaynak kodu barındırma ve işbirliği araçları"
          },
          "copilot": {
            "name": "GitHub Copilot",
            "description": "Yapay zeka destekli kod önerileri ve tamamlama asistanı"
          },
          "antigravity": {
            "name": "Antigravity",
            "description": "Bulut yapay zeka servisleri ve web erişim araçları"
          },
          "ollama": {
            "name": "Ollama",
            "description": "AI modellerini cihazınızda yerel olarak çalıştırın"
          },
          "claude": {
            "name": "Claude",
            "description": "Antropik Claude akıl yürütme modelleri"
          },
          "nvidia": {
            "name": "NVIDIA",
            "description": "Yerel GPU hızlandırma ve model çalışma süresi"
          },
          "codex": {
            "name": "OpenAI / ChatGPT",
            "description": "GPT modelleri ve gelişmiş dil yetenekleri"
          }
        },
        "apiKeyProvidersDescription": "Yapay zeka sağlayıcılarına doğrudan erişim için API anahtarları ekleyin. Yük dengeleme için sağlayıcı başına birden fazla anahtar ekleyebilirsiniz.",
        "apiProviders": {
          "openai": {
            "name": "OpenAI",
            "description": "GPT-4o, o1, o3 ve gelişmiş dil modelleri"
          },
          "anthropic": {
            "name": "Anthropic",
            "description": "Claude Sonnet, Opus ve Haiku modelleri"
          },
          "mistral": {
            "name": "Mistral AI",
            "description": "Mistral Büyük, Orta ve Küçük modeller"
          },
          "gemini": {
            "name": "Google Gemini",
            "description": "Gemini 2.0 Flash ve Pro modelleri"
          },
          "together": {
            "name": "Together AI",
            "description": "Hızlı çıkarıma sahip açık kaynaklı modeller"
          },
          "perplexity": {
            "name": "Perplexity",
            "description": "Gerçek zamanlı web erişimiyle yapay zeka araması"
          },
          "cohere": {
            "name": "Cohere",
            "description": "Command R+ kurumsal yapay zeka modelleri"
          },
          "groq": {
            "name": "Groq",
            "description": "LPU teknolojisiyle ultra hızlı çıkarım"
          },
          "openrouter": {
            "name": "OpenRouter",
            "description": "200'den fazla yapay zeka modeli için birleştirilmiş API"
          },
          "deepseek": {
            "name": "Derin Arama",
            "description": "DeepSeek V3 ve akıl yürütme modelleri"
          },
          "xai": {
            "description": "Grok-2 konuşma yapay zekası",
            "name": "xAI (Grok)"
          }
        },
        "running": "KOŞMA",
        "active": "Aktif",
        "connect": "Bağlamak",
        "removeAccount": "Kaldırmak",
        "notRunning": "DURDURULDU",
        "accountCount": "{{count}} hesap",